id,title,date,author,folio,text
10_19_1,Erklärung (Herausgeberschaft),1810-10-22,Heinrich von Kleist,[[ba_10_19.md]],"Erklärung.

S. Voß. Zeitung, den 25. Sept. 1810.

Mancherlei Rücksichten bestimmen mich, mit diesem Blatt, welches sich nunmehr etablirt hat, aus der Masse anonymer Institute herauszutreten. Demnach bleibt der Zweck desselben zwar, in der ersten Instanz, Unterhaltung aller Stände des Volks; in der zweiten aber ist er, nach allen erdenklichen Richtungen, Beförderung der Nationalsache überhaupt: und mit meinem verbindlichsten Dank an den unbekannten Herrn Mitarbeiter, der, in dem nächstfolgenden Aufsatz, zuerst ein gründliches Gespräch darüber eingieng, unterschreibe ich mich, der Herausgeber der Abendblätter, Heinrich von Kleist."
10_60_1,Eine Legende nach Hans Sachs. Der Welt Lauf.,1810-12-08,Redaktion,[[ba_10_60.md]],"Eine Legende nach Hans Sachs.

Der Welt Lauf.

Der Herr und Petrus oft, in ihrer Liebe beide, Begegneten im Streite sich, Wenn von der Menschen Heil die Rede war; Und dieser nannte zwar die Gnade Gottes groß, Doch wär’ er Herr der Welt, meint’ er, Würd’ er sich ihrer mehr erbarmen. Da trat, zu einer Zeit, als längst, in beider Herzen, Der Streit vergessen schien, und just, Um welcher Ursach weiß ich nicht, Der Himmel oben auch voll Wolken hieng, Der Sanctus mißgestimmt, den Heiland an, und sprach: „Herr, laß, auf eine Handvoll Zeit, Mich, aus dem Himmelreich, auf Erden niederfahren, Daß ich des Unmuths, der mich griff, Vergess’ und mich einmal, von Sorgen frei, ergötze, Weil es jetzt grad’ vor Fastnacht ist.“ Der Herr, des Streits noch sinnig eingedenk, Spricht: „Gut; acht Tag’ geb’ ich dir Zeit, Der Feier, die mir dort beginnt, dich beizumischen; Jedoch, sobald das Fest vorbei, Kommst du mir zur gesetzten Stunde wieder. Acht volle Tage doch, zwei Wochen schon, und mehr, Ein abgezählter Mond vergeht, Bevor der Sanct zum Himmel wiederkehrt. „Ei, Petre,“ spricht der Herr, „wo weiltest du so lange? Gefiel’s auch nieden dir so wohl?“ Der Sanctus, mit noch schwerem Kopfe, spricht: „Ach, Herr! Das war ein Jubel unten —! Der Himmel selbst beseeliget nicht besser. Die Erndte, reich, du weißt, wie keine je gewesen, Gab alles was das Herz nur wünscht, Getraide, weiß und süß, Most, sag’ ich dir, wie Honig, Fleisch fett, dem Speck gleich, von der Brust des Rindes; Kurz, von der Erde jeglichem Erzeugniß Zum Brechen alle Tafeln voll. Da ließ ich’s, schier, zu wohl mir sein, Und hätte bald des Himmels gar vergessen.“ Der Herr erwiedert: „Gut! Doch Petre sag mir an, Bei soviel Seegen, den ich ausgeschüttet, Hat man auch dankbar mein gedacht? Sahst du die Kirchen auch von Menschen voll?“ — Der Sanct, bestürzt hierauf, nachdem er sich besonnen, „O Herr,“ spricht er, „bei meiner Liebe, Den ganzen Fastmond durch, wo ich mich hingewendet, Nicht deinen Namen hört’ ich nennen. Ein einz’ger Mann saß murmelnd in der Kirche: Der aber war ein Wucherer, Und hatte Korn, im Herbst erstanden, Für Mäus’ und Ratzen hungrig aufgeschüttet.“ — „Wohlan denn,“ spricht der Herr, und läßt die Rede fallen, „Petre, so geh; und künft’ges Jahr Kannst du die Fastnacht wiederum besuchen“ Doch diesmal war das Fest des Herrn kaum eingeläutet, Da kömmt der Sanctus schleichend schon zurück. Der Herr begegnet ihm am Himmelsthor und ruft: „Ei, Petre! Sieh! Warum so traurig? Hat’s dir auf Erden denn danieden nicht gefallen?“ „Ach, Herr,“ versetzt der Sanct, „seit ich sie nicht gesehn, Hat sich die Erde ganz verändert. Da ist’s kurzweilig nicht mehr, wie vordem, Rings sieht das Auge nichts, als Noth und Jammer. Die Erndte, ascheweiß versengt auf allen Feldern, Gab für den Hunger nicht, um Brod zu backen, Viel wen’ger Kuchen, für die Lust, und Stritzeln. Und weil der Herbstwind früh der Berge Hang durchreift, War auch an Wein und Most nicht zu gedenken. Da dacht ich: was auch sollst du hier? Und kehrt’ ins Himmelreich nur wieder heim.“ — „So!“ spricht der Herr. „Fürwahr! Das thut mir leid! Doch, sag mir an: gedacht’ man mein?“ „Herr, ob man dein gedacht? — Die Wahrheit dir zu sagen, Als ich durch eine Hauptstadt kam, Fand ich, zur Zeit der Mitternacht, Vom Altarkerzenglanz, durch die Portäle strahlend, Dir alle Märkt’ und Straßen hell; Die Glöckner zogen, daß die Stränge rissen; Hoch an den Säulen hiengen Knaben, Und hielten ihre Mützen in der Hand. Kein Mensch, versichr’ ich dich, im Weichbild rings zu sehn, Als Einer nur, der eine Schaar Lastträger keuchend von dem Hafen führte: Der aber war ein Wucherer, Und häufte Korn auf lächelnd, fern erkauft, Um von des Landes Hunger sich zu mästen.“ „Nun denn, o Petre,“ spricht der Herr, „Erschaust du jetzo doch den Lauf der Welt! Jetzt siehst du doch was du jüngsthin nicht glauben wolltest, Daß Güter nicht das Gut des Menschen sind; Daß mir ihr Heil am Herzen liegt wie dir: Und daß ich, wenn ich sie mit Noth zu weilen plage, Mich, meiner Liebe Treu und meiner Sendung, Nur ihrer höh’ren Noth erbarme."
11_07-5,Sinnentstellende Druckfehler in Nro. 4. des Abendblatts,1811-01-09,Heinrich von Kleist,[[ba_11_07.md]],"Sinnentstellende Druckfehler in Nro. 4. des Abendblatts.

Seite 14, Zeile 9 von unten, hinter Beredsamkeit. lies: über die Form; – 15, – 16 von oben, statt Rnde, lies Rede. – – – 16 und 17, statt des Rhythmus, Wohlklangs, lies Rhythmus, Wohlklang."
10_32_4,Miscellen. (6.11.1810),1810-11-06,Heinrich von Kleist,[[ba_10_32.md]],"Miscellen.

Unter einem Artikel: London vom 10 Okt. wird gemeldet, daß zur Wiedereinschiffung der englischen Armee in Portugal, falls es die Umstände nothwendig machen sollten, Alles in Bereitschaft ist. Dem Admiral Berkley ist die Sorge dafür übertragen. (Jour. d. l’Emp.)

Lord Wellington hat bei Torres Vedras mit seiner Armee festen Fuß gefaßt, und scheint entschlossen in dieser starken Position, zwischen dem Tago und dem Meere, den General Massena, der ihm folgt, zu erwarten. (J. d. l’E.)

Man glaubt, daß die Franzosen im Besitz von Oporto sind, wo man keine einzige Kanone gelassen hatte, so daß die Stadt ohne Vertheidigung war.

Der Engl. Brig. Gen. Crawfurd ist in Portugall an einer Krankheit gestorben.

Alle conföderirte Staaten haben sich beeifert dem Beispiel Frankreichs, die Colonialwaaren betreffend, nachzufolgen. Ueberall erreicht diese Maasregel ihren Zweck; überall spürt man die glücklichen Wirkungen davon: im Würtembergischen ist der Preis der Colonialwaaren noch an demselben Tage, da die Publikation der Regierung erschien, um die Hälfte gestiegen u. s. w. (Mon.)"
10_77_4,Seufzer eines Ehemanns.,1810-12-31,Ludwig Giseke,[[ba_10_77.md]],"Seufzer eines Ehemanns.

Seit uns des Priesters Hand Am Traualtar verband, Hat meine Frau — was bin ich doch geplagt! — Nie wieder Ja gesagt."
10_08_4,Stadt-Gerücht.,1810-10-09,Heinrich von Kleist,[[ba_10_08.md]],"Stadt-Gerücht.

Die berüchtigte Louise, von der Mordbrenner-Bande, soll vorgestern unerkannt auf dem Posthause gewesen sein, und daselbst nach Briefen gefragt haben. Es ist nicht unmöglich, daß dieselbe sich noch in diesem Augenblick in der Stadt befindet."
10_06_1,Kunst-Ausstellung,1810-10-06,Ludolph Beckedorff,[[ba_10_06.md]],"Kunst-Ausstellung.

Gestern endlich ist auch das Porträt der hochseeligen Königinn vom Herrn Wilhelm Schadow auf die Ausstellung gebracht worden.

Bey Lebzeiten Ihrer Majestät ist es keinem Mahler gelungen, ein nur einigermaaßen ähnliches Bild von Ihr hervorzubringen. Wer hätte es auch wagen dürfen, diese erhabene und doch so heitere Schönheit, die lebendige, bewegliche, geistreiche, holdselige Freundlichkeit und den ganzen, unendlichen, immer neuen Liebreitz Ihres Wesens neben dem Ausdrucke des sinnigen Ernstes und der würdevollen Hoheit in dieser königlichen Frau festhalten oder gar wiedergeben zu wollen? Erst nachdem Sie selbst hinweggenommen worden ist, und die niederschlagende Vergleichung mit dem unerreichbaren Originale nicht mehr Statt finden kann, scheint die begeisterte Trauer, womit um sie geklagt wird, Ihr Bild treuer ergriffen zu haben.

Seine Majestät, der König, hat das Schadowsche Porträt für das ähnlichere erklärt und dadurch den Werth desselben in dieser Rücksicht bestimmt. Denn wo gäbe es einen sicherern Maaßstab dafür, wo ein lebendigeres und vollständigeres Bild der verewigten Monarchinn als in der treuen traurenden Erinnerung des erhabenen Wittwers? Der König findet das Bild ähnlich; Er billigt es; mehr bedarf es nicht, um demselben alle Stimmen zuzuwenden. Daß Sein heiliger Schmerz ohne Widerwillen und Störung bei diesen Zügen verweilen kann, dadurch wird dies Bild geadelt und weit hinausgehoben über jede Verantwortlichkeit gegen Wünsche, Forderungen und Ansprüche, die daran von Liebhabern, Kennern und Künstlern anderweitig erhoben werden könnten.

Ueberdem scheint dasselbe noch nicht ganz fertig gemahlt zu seyn, und kann auch aus diesem Grunde einer vollständigen Beurtheilung noch nicht unterworfen werden. Indessen ist es nicht unbillig, daß die Kritik, mit je größerem Rechte dieses Bild des jungen Mahlers sich derselben entzieht, um desto strenger in der Beurtheilung der übrigen Porträte verfahre, womit derselbe die Ausstellung hat zieren wollen.

(Wird fortgesetzt.)"
10_12_7,(Anzeige J. E. Hitzig v. 13.10.1810),1810-10-13,J. E. Hitzig,[[ba_10_12.md]],"Montag, den 15ten d. M.

wird bei J. E. Hitzig, hinter der katholischen Kirche Nr. 3, und in der Expedition der Berliner Abendblätter, Jägerstraße Nr. 25, ausgegeben:

UNIVERSITATI LITTERARIAE.

Kantate auf den 15ten Okt. 1810 von Clemens Brentano. Mit einer schönen Titelvignette, das Universitätsgebäude vorstellend.4to splendid gedruckt und geh. 10 Gr. Cour."
11_15-2,Bülletin der öffentlichen Blätter. (18.01.1811),1811-01-18,Redaktion,[[ba_11_15.md]],"Bülletin der öffentlichen Blätter.

London, den 1sten Januar.

Ueber die um die Mitte des Novembers statt gehabte rückgängige Bewegung des Marschalls Massena enthält der Star einen Brief, aus dem Hauptquartier Cartayo, vom 30. Nov., aus welchem hervorgeht, daß noch keine Schlacht statt gehabt, und daß es auch das Ansehen habe, als werde überhaupt keine so bald statt finden. Die Französische Armee brach in solcher Stille aus ihrem Lager auf, daß man, im Lager Wellingtons, erst bei Tagesanbruch, als keine Spur jener Armee mehr da war, solches gewahr ward. Die Stellung, welche Massena bei Santarem einnahm, war durch Flüsse und Sümpfe so gedeckt, daß nur 2 Chausseen auf das Plateau der Hügelkette führten, auf welcher Massena stand. Wellington entschloß sich, ihn hier anzugreifen. Zu seinem Glück entstand dadurch eine solche Versäumniß, daß General Pack eine Kanone, mit welcher das Signal zum Angriff gegeben werden sollte, nicht fortbringen konnte; der General Spencer, der indeß herbeigekommen war, ward von dem bloßen Gedanken dieses Projekts wie versteinert, und erklärte es für unausführbar. Seitdem sind, durch große Regengüsse, die Flüsse im Thal so ange schwollen, daß keine der beiden Armeen zu der anderen kommen kann, wenn sie auch noch so gern wollte. Demnach ist nichts Merkwürdiges vorgefallen, außer daß Wellington 2000 Ochsen, die für die französische Armee zusammengebracht waren, in die Hände gerathen sind. (Mon.)

London, den 2ten Januar.

Sowohl im Ober- als Unter-Hause sind gegen die Beschränkung der Regentschaft, welche, mit einer beträchtlichen Stimmenmehrheit, durchgegangen ist, Protestationen eingelegt worden. Man erwartet noch heute Abend eine sehr stürmische Sitzung, in der man auf den Widerruf der genommenen Beschlüsse dringen wird. (L. d. B.)"
10_72_1,(Jahrestag der Rückkehr des preußischen Königspaares nach Berlin),1810-12-22,Georg Philipp Ludolph von Beckedorff,[[ba_10_72.md]],"Am Sonnabende vor Weihnachten des vorigen Jahres, also — dem Tage nach — heute vor einem Jahre, war es, als das Königliche Paar, welches nach Gottes Willen irrdischer Weise jetzo getrennt ist, zusammen in seine getreue Stadt Berlin wieder einzog.

Es ist erlaubt und natürlich, jenes festlichen Tages, den selbst der Himmel damals, nach vielen trüben Wochen, mit seiner ersten schönsten Heitre schmückte, sich heute betrachtungsvoll zu erinnern.

Ein leichter Reif der Nacht hatte die Straßen der Stadt wie mit Blüthen überstreut; von allen Thürmen wehten weiße Friedensfahnen; erwartungsvoll, eilig und geputzt wie zum Sonntage, zog jeder in der Frühe aus seinem Hause; ungeduldig strömten viele tausende hinaus auf den Heerwege; bedächtiger wählten sich die meisten ihre Plätze in der Stadt. Bald waren alle Straßen leer, nur auf dem Wege, welchen die Erwarteten kommen sollten, stand zu beiden Seiten dicht gedrängt die Menge und über ihnen schauten aus allen Fenstern frohe Gesichter. Aber kein Getümmel, kein Lärm; allenthalben Ruhe, Ordnung und erwartungsvolle Stille. Endlich ward der freudenreiche Donner des Geschützes gehört und das Geläute der Glocken, welches die Kommenden verkündigte; dann Trompetenschall von weitem und Jubelgeschrei, das immer näher sich heranwälzte. Nun war es gewiß und wirklich und entschieden: Sie kamen, Sie waren schon in diesen Mauren. Die ersten Reiter wurden schon erblickt; sie nahten; sie zogen vorüber; noch ein Augenblick — und jetzt — Er selbst, der König! Er war wieder da, ganz nahe, grüßend, freundlich und bald nach Ihm auch Sie, die Herrliche, die nicht mehr ist. Wer hielt da den lauten, langen, jauchzenden Ruf der Freude zurück? Ueber wessen Lippen drängte sich nicht der stürmende Jubel des Willkommens? Wessen Herz zitterte nicht von Dank, Hoffnung, Wunsch, Freude, Gebet, Vorsatz und Entschluß? Alles war vergessen, vergangen, ausgelitten; an der Schwelle einer goldnen Zukunft stand der schöne Augenblick.

Vieles ist in Erfüllung gegangen, was damals gehofft wurde. Zutrauen im Aeußern und Innern sind zurückgekehrt; Gewerbe, Handel und Wandel haben neues Leben gewonnen: der kleinliche Verdruß des Augenblicks über unvermeidliche Schicksale hat sich mehr und mehr in besonnene Betrachtung aufgelöst; ein erhöhter Antheil an den vaterländischen Dingen hat sich vielfältig bewährt; Verdienste sind belohnt, Parteien vereint, getreue, bewährte, uneigennützige Männer in den Mittelpunct der Verwaltung gehoben, die Hoffnung auf eine bessere Verfassung ist erregt und ein immer festeres Band zwischen der Nazion und ihrem Könige geknüpft worden.

Aber viel, sehr viel, das Beste und Herrlichste, was wir besaßen, haben wir auch verlieren müssen. Auch dieses schmerzlichen Verlustes muß heute gedacht werden, mit neuer, tiefer, inniger Trauer, aber zugleich mit dem ewigen Troste, den das nahe seegensreiche Fest Desjenigen gewährt, der nur in die Welt kam, um zu sterben, durch dessen Tod kein Tod mehr furchtbar ist und mit des heiligen Namen auf der erblassenden Lippe Sie heilig entschlafen ist, um welche wir trauern.

Gott erhalte den König!

L. B."
10_53_2,Berichtigung (30.11.1810),1810-11-30,Friedrich Schulz,[[ba_10_53.md]],"Berichtigung.



In den Theaterartikeln der Spenerschen und Vossischen Zeitungen scheint man die Behauptung aufzustellen, als wenn Mslle. Beck die Rolle der Jungfrau von Orleans mit Hülfe der Mad. Schütz einstudirt und ganz nach ihrer Anleitung und ihrem Vorbild ausgeführt habe. Dies ist aber gar nicht der Fall. Mslle. Beck hat hier zum erstenmal diese Rolle gespielt und erst hier einstudirt und wenn ein so junges Talent hier und da eines Fingerzeigs zur richtigen Einsicht in die Rolle bedurfte, so kann man wohl errathen, wer diese Fingerzeige gegeben hat. So wahr es übrigens sein mag, daß Mslle. Beck in manchen Stellen an Mad. Schütz erinnert, so unbegreiflich ist es doch, wie man ihre von Anfang bis zu Ende freie und lebendige Darstellung, sowie die ganze Beschaffenheit, den Umfang ihrer Töne, und den Gebrauch, den sie davon macht — ähnlich mit der so ungleichen, bald kräftigen, bald matten, hier mächtig ergreifenden, dort wahrhaft widrig werdenden Spielweise der Mad. Schütz finden kann."
10_36_1,Allerneuester Erziehungsplan. (Beschluß.) (10.11.1810),1810-11-10,Heinrich von Kleist,[[ba_10_36.md]],"Allerneuester Erziehungsplan.

(Beschluß.)

In Erwägung nun *) 1) daß alle Sittenschulen bisher nur auf den Nachahmungstrieb gegründet waren, und statt das gute Princip, auf eigenthümliche Weise im Herzen zu entwickeln, nur durch Aufstellung sogenannter guter Beispiele, zu wirken suchten **); 2) daß diese Schulen, wie die Erfahrung lehrt, nichts eben, für den Fortschritt der Menschheit Bedeutendes und Erkleckliches, hervorgebracht haben ***); das Gute aber 3) das sie bewirkt haben, allein von dem Umstand herzurühren scheint, daß sie schlecht waren, und hin und wieder, gegen die Verabredung, einige schlechten Beispiele mitunter liefen; in Erwägung, sagen wir, aller dieser Umstände, sind wir gesonnen, eine sogenannte Lasterschule, oder vielmehr eine gegensätzische Schule, eine Schule der Tugend durch Laster, zu errichten †).

Demnach werden für alle, einander entgegenstehende Laster, Lehrer angestellt werden, die in bestimmten Stunden des Tages, nach der Reihe, auf planmäßige Art, darin Unterricht ertheilen: in der Religionsspötterei sowohl als in der Bigotterie, im Trotz sowohl als in der Wegwerfung und Kriecherei, und im Geiz und in der Furchtsamkeit sowohl, als in der Tollkühnheit und in der Verschwendung.

Diese Lehrer werden nicht bloß durch Ermahnungen, sondern durch Beispiel, durch lebendige Handlung, *) Jetzt rückt dieser merkwürdige Pädagog mit seinem neuesten Erziehungsplan heraus. (Die Redaction.) **) So! — Als ob die pädagogischen Institute nicht, nach ihrer natürlichen Anlage, schwache Seiten genug darböten! (Die Redact.) ***) In der That! — — Dieser Philosoph könnte das Jahrhundert um seinen ganzen Ruhm bringen. (Die Redact.) †) Risum teneatis, amici! (Die Redact.) durch unmittelbaren praktischen, geselligen Umgang und Verkehr zu wirken suchen.

Für Eigennutz, Plattheit, Geringschätzung alles Großen und Erhabenen und manche anderen Untugenden, die man in Gesellschaften und auf der Straße lernen kann, wird es nicht nöthig sein, Lehrer anzustellen.

In der Unreinlichkeit und Unordnung, in der Zank- und Streitsucht und Verläumdung, wird meine Frau Unterricht ertheilen.

Liederlichkeit, Spiel, Trunk, Faulheit und Völlerei, behalte ich mir bevor.

Der Preis ist der sehr mäßige von 300 Rthl.

N. S.

Eltern, die uns ihre Kinder nicht anvertrauen wollten, aus Furcht, sie in solcher Anstalt, auf unvermeidliche Weise, verderben zu sehen, würden dadurch an den Tag legen, daß sie ganz übertriebene Begriffe von der Macht der Erziehung haben. Die Welt, die ganze Masse von Objecten, die auf die Sinne wirken, hält und regiert, an tausend und wieder tausend Fäden, das junge, die Erde begrüßende, Kind. Von diesen Fäden, ihm um die Seele gelegt, ist allerdings die Erziehung Einer, und sogar der wichtigste und stärkste; verglichen aber mit der ganzen Totalität, mit der ganzen Zusammenfassung der übrigen, verhält er sich wie ein Zwirnsfaden zu einem Ankertau; eher drüber als drunter.

Und in der That, wie mißlich würde es mit der Sittlichkeit aussehen, wenn sie kein tieferes Fundament hätte, als das sogenannte gute Beispiel eines Vaters oder einer Mutter, und die platten Ermahnungen eines Hofmeisters oder einer französischen Mamsell. — Aber das Kind ist kein Wachs, das sich, in eines Menschen Händen, zu einer beliebigen Gestalt kneten läßt: es lebt, es ist frei; es trägt ein unabhängiges und eigenthümliches Vermögen der Entwickelung, und das Muster aller innerlichen Gestaltung, in sich.

Ja, gesetzt, eine Mutter nähme sich vor, ein Kind, das sie an ihrer Brust trägt, von Grund aus zu verderben: so würde sich ihr auf der Welt dazu kein unfehlbares Mittel darbieten, und, wenn das Kind nur sonst von gewöhnlichen, rechtschaffenen Anlagen ist, das Unternehmen, vielleicht auf die sonderbarste und überraschendste Art, daran scheitern.



Was sollte auch, in der That, aus der Welt werden, wenn den Eltern ein unfehlbares Vermögen beiwohnte, ihre Kinder nach Grundsätzen, zu welchen sie die Muster sind, zu erziehen: da die Menschheit, wie bekannt, fortschreiten soll, und es mithin, selbst dann, wenn an ihnen nichts auszusetzen wäre, nicht genug ist, daß die Kinder werden, wie sie; sondern besser.

Wenn demnach die uralte Erziehung, die uns die Väter, in ihrer Einfalt, überliefert haben, an den Nagel gehängt werden soll: so ist kein Grund, warum unser Institut nicht, mit allen andern, die die pädagogische Erfindung, in unsern Tagen, auf die Bahn gebracht hat, in die Schranken treten soll. In unsrer Schule wird, wie in diesen, gegen je Einen, der darin zu Grunde geht, sich ein andrer finden, in dem sich Tugend und Sittlichkeit auf gar robuste und tüchtige Art entwickelt; es wird Alles in der Welt bleiben, wie es ist; und was die Erfahrung von Pestalozzi und Zeller und allen andern Virtuosen der neuesten Erziehungskunst, und ihren Anstalten sagt, das wird sie auch von uns und der unsrigen sagen: „Hilft es nichts, so schadet es nichts.“

Rechtenfleck im Holsteinischen, den 15. Oct. 1810. C. J. Levanus, Conrector."
10_15_2,Theater. Unmaßgebliche Bemerkung,1810-10-17,Heinrich von Kleist,[[ba_10_15.md]],"Theater.

Unmaßgebliche Bemerkung.

Wenn man fragt, warum die Werke Göthe’s so selten auf der Bühne gegeben werden, so ist die Antwort gemeinhin, daß diese Stücke, so vortrefflich sie auch sein mögen, der Casse nur, nach einer häufig wiederholten Erfahrung, von unbedeutendem Vortheil sind. Nun geht zwar, ich gestehe es, eine Theater Direction, die, bei der Auswahl ihrer Stücke, auf nichts, als das Mittel sieht, wie sie besteht, auf gar einfachem und natürlichem Wege, zu dem Ziel, der Nation ein gutes Theater zu Stande zu bringen. Denn so wie, nach Adam Smith, der Bäcker, ohne weitere chemische Einsicht in die Ursachen, schließen kann, daß seine Seṁel gut sei, wenn sie fleißig gekauft wird: so kann die Direction, ohne sich im Mindesten mit der Kritik zu befassen, auf ganz unfehlbare Weise, schließen, daß sie gute Stücke auf die Bühne bringt, wenn Logen und Bänke immer, bei ihren Darstellungen, von Menschen wacker erfüllt sind. Aber dieser Grundsatz ist nur wahr, wo das Gewerbe frei, und eine uneingeschränkte Concurrenz der Bühnen eröffnet ist. In einer Stadt, in welcher mehrere Theater nebeneinander bestehn, wird allerdings, sobald auf irgend einem derselben, durch das einseitige Bestreben, Geld in die Casse zu locken, das Schauspiel entarten sollte, die Betriebsamkeit eines andern Theaterunternehmers, unterstützt von dem Kunstsinn des besseren Theils der Nation, auf den Einfall gerathen, die Gattung, in ihrer ursprünglichen Reinheit, wieder festzuhalten. Wo aber das Theater ein ausschließendes Privilegium hat, da könnte uns, durch die Anwendung eines solchen Grundsatzes, das Schauspiel ganz und gar abhanden kommen. Eine Direction, die einer solchen Anstalt vorsteht, hat eine Verpflichtung sich mit der Kritik zu befassen, und bedarf wegen ihres natürlichen Hanges, der Menge zu schmeicheln, schlechthin einer höhern Aufsicht des Staats. Und in der That, wenn auf einem Theater, wie das Berliner, mit Vernachlässigung aller anderen Rücksichten, das höchste Gesetz, die Füllung der Casse wäre: so wäre die Scene unmittelbar, den spanischen Reutern, Taschenspielern und Faxenmachern einzuräumen: ein Specktakel, bei welchem die Casse, ohne Zweifel, bei weitem erwünschtere Rechnung finden wird, als bei den göthischen Stükken. Parodieen hat man schon, vor einiger Zeit, auf der Bühne gesehen; und wenn ein hinreichender Aufwand von Witz, an welchen es diesen Producten zum Glück gänzlich gebrach, an ihre Erfindung gesetzt worden wäre, so würde es, bei der Frivolität der Gemüther, ein Leichtes gewesen sein, das Drama vermittelst ihrer, ganz und gar zu verdrängen. Ja, gesetzt, die Direction käme auf den Einfall, die göthischen Stücke so zu geben, daß die Männer die Weiber- und die Weiber die Männerrollen spielten: falls irgend auf Costüme und zweckmäßige Carrikatur einige Sorgfalt verwendet ist, so wette ich, man schlägt sich an der Casse um die Billets, das Stück muß drei Wochen hinter einander wiederholt werden, und die Direction ist mit einemmal wieder solvent. — Welches Erinnerungen sind, werth, wie uns dünkt, daß man sie beherzige.

H. v. K."
