id,title,date,author,folio,text
10_17_4,Polizeiliche Tages-Mittheilungen (19.10.1810),1810-10-19,Redaktion,[[ba_10_17.md]],"Polizeiliche Tages-Mittheilungen.

Ein Zimmergesell war vorgestern bei einem Bau in der Behrenstraße beschäftiget, mit einem seiner Kameraden einen Balken aus dem Hause zu tragen. Ein noch nicht ausgemittelter Fuhrmann fuhr mit seinem Wagen so heftig gegen den Balken, daß dieser den Zimmergesellen umwarf und auf der Stelle todtschlug.

Auf dem Gensd’armen-Markt sind zweien Bauern, einem Jeden eine ungestempelte Metze konfiszirt und 2 Rthlr. Strafe eingezogen worden.

Auf dem Spittelmarkt hat eine Gärtnerin sich verbotwidrig über einen offenen Kohlentopf gesetzt, welcher in Beschlag genommen worden ist.

Einem Bäcker ist für 6 Gr. zu leichtes Brod konfiszirt.

Einem Schlächter eine unrichtige Waage. Die Schaale auf welcher das Fleisch gelegt wurde, war um 2 Loth schwerer, als die Schaale zu den Gewichten.

An einem Haufen Torf, den ein hiesiger Einwohner von einem Schiffer gekauft hat, fehlten bei der Revision 26½ Kiepen, weshalb eine Untersuchung eingeleitet ist."
10_70_2,Bülletin der öffentlichen Blätter (20.12.1810),1810-12-20,Redaktion,[[ba_10_70.md]],"Bülletin der öffentlichen Blätter.

Andreas Pearse, Arbeiter in einer Decken-Fabrik in Bristol, heirathete am 20. Januar 1801 Hanna Taylor, und mit derselben zeugte er binnen sechs Jahren vierzehn Kinder. Drei Söhne wurden ihm am 1. Okt. 1801 geboren; zwei Söhne am 3. Okt 1802; ein Knabe und ein Mädchen am 16. Juli 1803; zwei Knaben am 13. Mai 1804; ein Knabe und ein Mädchen am 14. Jan. 1806; und endlich ein Knabe am 16. Nov. 1807.

(Arch. für Geogr.)"
11_07-1,Bülletin der öffentlichen Blätter. (09.01.1811),1811-01-09,Redaktion,[[ba_11_07.md]],"Bülletin der öffentlichen Blätter.

Großbritannien.

Da so häufig der Stocks-Börse und Stocks Mäklers erwähnt wird, so wollen wir hievon eine kurze Uebersicht geben. „Die Käufer der Stocks heißen Bären. Man will dadurch zu erkennen geben, daß ihre Bemühungen dahin gehen, die Fonds auf einen niedrigen Preis herabzubringen, um sie sich alsdann für einen wohlfeileren Preis zu verschaffen. Die Verkäufer hingegen werden Bulls genannt, wodurch man ihre Bemühungen andeuten will, die Stocks hinauf zu treiben. Gewöhnlich glaubt man, daß der Stockshandel nichts wie Mysterien enthalte, die nur den Augen der Eingeweihten entdeckt werden, allein er ist nichts anders, als der Marktplatz, wo die Nazionalpfänder, die Interessen tragen, gekauft und wieder verkauft werden. Stockbrokers oder Stockjobbers heißen nun diejenigen, welche mit diesem Artikel Handel treiben, dieses mag nun geschehen für ihre eigene oder für fremde Rechnung. Zur nähern Auseinandersetzung dieses Gegenstandes müssen wir auf den Ursprung der englischen Nationalschuld, der Fonds oder Stocks, welches gleichbedeutende Wörter sind, zurückgehen. Kurz vor der Revolution existirte in England keine fundirte National-Schuld. Die Fürsten vor dieser Periode halfen gewöhnlich den Bedürfnissen durch forcirte Anleihen ab, deren Wiederbezahlung sehr precair war; denn sie hing ganz allein von der Rechtschaffenheit und dem Glücke des Anleihers ab; allein eine solche Anleihe war damals nicht wie jetzt für die Nachkommenschaft eine Bürde. Seit der merkwürdigen Periode aber, welche dem Volke die gesetzliche Freiheit wieder gab, hat es kein König von England gewagt, sich willkührlich an dem Eigen thume seiner Unterthanen zu vergreifen, oder auch nur auf willkührliche Bedingungen es ihnen abzufordern. Wenn nun die jährliche Ausgabe der Regierung die Einnahme übersteigt, und man für nöthig findet, größere Summen, als die gewöhnlichen Taxen und Abgaben aufbringen, zu erheben, so schreitet man zu der Maaßregel, bei Kapitalisten die erforderliche Summe anzuleihen, und der Nation wird nur eine verhältnißmäßig kleine Abgabe auferlegt, um die Zinsen des von dem Gouvernement im Namen der Nation geliehenen Kapitals zu decken. Es ist hier nicht der Ort, zu untersuchen, ob eine solche Maaßregel, wodurch der Nachkommenschaft eine große Last aufgebürdet wird, die doch die jetzige Generation tragen müßte, gut oder schlecht, politisch oder unpolitisch sey; genug, dieses System ist einmal angenommen, und giebt eine deutliche Ansicht von der Entstehung der Fonds. Der Kaufmann, der nun Geldsummen bei sich liegen hat, findet bei solchen Anleihen, unter Garantie der Nation, eine gute Gelegenheit, sein Kapital unterzubringen. Auf diese Art hat das Gouvernement seit der Revolution eine Summe von fast 600 Mill. Pf. St. angeliehen. Die National-Schuld eröffnete den Kapitalisten ein neues Feld zur Spekulation, und gab einer neuen Art von Erwerb zwischen dem Käufer und Verkäufer dieser Art Eigenthum seine Entstehung. So wie der Verkauf der Fonds zunahm, vervielfältigte sich auch die Anzahl der Eigenthümer, und die Nothwendigkeit, dieses Geschäft andern zu übertragen, ward immer stärker gefühlt. Diese Umstände machten, daß die dabei interessirten Personen sich einander näherten, und so kam es, daß man zu Jonathans, jetzt Garraways, Kaffehaus, in Cornhill u. s. w., Zusammenkünfte der Stocksinhaber und ihrer Agenten verabredete. Allmählig arteten diese in ordentliche Märkte aus, wo die Preise der Stocks bestimmt wurden. Allein bald ward nun diese Art von Handel so wichtig und umfassend, daß man ausschließlich für dieses Geschäft auf Subscription ein Gebäude errichtete, welches man Stocks-Börse nannte. Nach dieser kurzen Uebersicht des Ursprunges der Stocks-Börse, so wie der Beschäftigung eines StocksMäklers, wird Niemand an der Wichtigkeit dieser Branche des Handels zweifeln, wodurch die Circulation eines so ungeheuern Kapitals, wie die Nationalschuld ist, sehr erleichtert und befördert wird."
10_71_4,(Anzeige Hitzig 21.12.1810),1810-12-21,Julius Eduard Hitzig,[[ba_10_71.md]],"Ein vorzüglich schönes Weihnachts-Geschenk zur Zimmer-Verzierung für den gebildeten Theil des Publikums

sind Göthe, Schiller, Herder und Wieland, vier saubere Gips-Medaillons, geformt nach Gerhard von Kügelgen in Dresden, von Posch. Sie kosten mit Glas und eleganten gebeizten Rahmen bei J. E. Hitzig hinter der katholischen Kirche No. 3. alle vier, 5 Thl. Courant; einzeln, das Stück 1 Thl. 8 Gr."
10_02_5,(Anzeige) J. E. Hitzig,1810-10-02,J. E. Hitzig,[[ba_10_02.md]],"Interessante Schriften, welche in der Buchhandlung von J. E. Hitzig zu haben sind.

von Woltmann Geist der neuen Preußischen Staatsorganisation. 20 gr.

J. C. F. Meister über mehrere schwierige Stellen im Persius und Horaz 8 gr.

Friedrich Rochlitz Denkmale glücklicher Stunden. Erster Theil. Mit Kupfern. 2 thl."
10_76_1,Polizeiliche Tages-Mittheilungen. (29.12.1810),1810-12-29,Redaktion,[[ba_10_76.md]],"Polizeiliche Tages-Mittheilungen.

Gestern Morgen gegen 9 Uhr kam hinter dem Königlichen Stalle in der breiten Straße ein bekleideter männlicher Leichnam, welcher noch nicht in Verwesung übergegangen ist, angeschwommen. Er wurde sogleich herausgezogen.

Am 26sten Abends um 8 Uhr ist ein Handschuhmacher-Lehrbursche hinter der Königl. Bäckerei bei der Kommunikations-Brücke ins Wasser gefallen, jedoch von einem Schlosserlehrlinge und einem hinzugekommenen Soldaten sogleich gerettet worden."
10_16_5,Neueste Nachricht,1810-10-18,Heinrich von Kleist,[[ba_10_16.md]],"Neueste Nachricht.

Der Ballon des Hrn. Claudius soll, nach der Aussage eines Reisenden, in Düben niedergekommen sein."
10_51_1,Geist neuere preussische Gesetzgebung,1810-11-28,Unbekannter Autor,[[ba_10_51.md]],"Ueber den Geist der neueren preussischen Gesetzgebung. Ein Fragment aus einer noch ungedruckten größeren Abhandlung.

Der Statistiker bestimmt die Rangordnung der Staaten nach ihrer Grundmacht d. h. nach ihrem Flächeninhalt und nach ihrer Bevölkerung; und im Allgemeinen ist dieses sehr richtig. Es giebt aber noch eine Rücksicht, die sich nicht so auf dem Papiere berechnen läßt, aber dennoch bei der Balance einen bedeutenden Ausschlag giebt: die Vaterlandsliebe. Man könnte sie das Princip der intensiven Macht der Staaten nennen. Bloße Bevölkerung ohne diese Rücksicht: das Princip der extensiven Macht.

Die intensive Macht eines Staates verhält sich zur extensiven, wie der innere Handel zum auswärtigen, d. h. sie ist wichtiger und reeller. Eine bloße Vergrößerung des Flächeninhalts und der Volksmenge ist ein sehr zweideutiges Mittel, die Macht eines Staates zu vermehren; ja öfters wird dadurch das Gegentheil bewirkt. Ich darf diese Behauptung wohl nicht näher beweisen, da die unglücklichen Ereignisse unserer Tage noch in Jedermanns Andenken sind. Was hat wohl die Besitznehmung der polnischen Provinzen, ohnerachtet aller Wohlthaten der mildesten Regierung, zur Vermehrung der Macht der preussischen Monarchie beigetragen?

Also — nicht in der Volksmenge allein besteht die Macht der Staaten, sondern in dem Grade der Anhänglichkeit dieser Volksmenge an ihre Verfassung und an die Person ihrer Beherrscher. Wir finden in der Geschichte Beispiele genug, daß Staaten, die, bloß nach statistischen Grundsätzen geschätzt, sehr ohnmächtig schienen, ihren an Volksmenge und Flächeninhalt unendlich überlegenen Feinden siegreich widerstanden. Die kleine Republik Athen schlug das zahllose Heer des Perserkönigs aufs Haupt, welches er selbst das Unüberwindliche nannte. Noch vor wenigen Jahrhunderten scheiterte die furchtbare mit Stahl bedeckte Macht des deutschen Kaisers, an dem Heroismus eines Häufleins nackter Schweizer. Solche anscheinend wunderbare Ereignisse werden durch die größere intensive Macht dieser kleinen Staaten zu natürlichen.

Es giebt also Mittel, die Macht der Staaten ohne Vergrößerung des Gebiets und der Volksmenge zu erhöhen. Es giebt Mittel, diejenigen Kräfte, welche ein Staat durch Verkleinerung seines Gebiets und seiner Volksmenge verlohren hat, in seinem Inneren zu ersetzen. Diese Mittel, viel sicherer als auswärtige Eroberungen, liegen in der Gewalt einer jeden Regierung, und gedeihen am besten im tiefsten Frieden. Sie darf nur die intensive Macht erhöhen, d. h. die Einwohner mehr als bisher an ihr Interesse knüpfen, und ihnen ihre Verfassung werth machen. Dieses geschieht durch Wegräumung alles desjenigen, welches die Anhänglichkeit an diese Verfassung und die Person des Regenten schwächen, und die so natürliche Liebe zu dem vaterländischen Boden verringern kann.

Dieses war die große Aufgabe der preussischen Regierung nach dem Tilsiter Frieden. Mit bedächtiger Weisheit hat sie angefangen sie zu lösen, und fährt nun damit fort.

Der preussische Staat hat durch diesen Frieden die Hälfte seiner extensiven Macht verlohren.

Die verlohrnen Meilen und Seelen konnte die Regierung freilich nicht ersetzen, wohl aber durch Eröffnung aller Wege, die zu einem allgemeinen Wohlstande führen können, durch Wegräumung der bisherigen Hindernisse der Industrie und Vaterlandsliebe, die intensive Macht der Gesellschaft erhöhen, und die Zahl der activen Staatsbürger vermehren. Denn gerade die zahlreichste Classe war bisher nicht zu den Staatsmitgliedern zu rechnen, weil sie kein Interesse an Aufrechthaltung einer Verfassung haben konnten, von der sie theils aus Mangel an Aufklärung kaum einen Begriff hatten, und die theils in Hinsicht ihrer zu stiefmütterlich war, als daß deren Umsturz ihnen hätte ein großes Uebel scheinen können.

Nun aber ist, durch das General-Edict vom 27ten Oct. 1810 welches das Edict vom 9ten Oct. 1808 über die Aufhebung der Erbunterthänigkeit, so wie die Militairverfassung, und die neue Städte-Ordnung, ergänzt, dem Preussischen Staat die frohe Aussicht geworden, das, was er an äußerer Macht verlor, in seinem Inneren wiederzufinden. Noch steht das Werk des erhabenen Gesetzgebers, der unter uns aufgetreten ist, nur unvollkommen vor den Augen der Welt da;gleichwohl werden wir bereits auf das Fundament, auf welchem es ruht, und auch vielleicht schon auf den Zusammenhang mehrerer Theile, im Laufe dieser Blätter erläuternde Blicke werfen können.

lh."
10_47_2,Schreiben redlichen Berliners,1810-11-23,Heinrich von Kleist,[[ba_10_47.md]],"Schreiben eines redlichen Berliners, das hiesige Theater betreffend, an einen Freund im Ausland.



Der Herr Theaterdirector Iffland, hat nach dem Geständniß eines großen Theils von Berlin, seit er an der Spitze des hiesigen Theaters steht, die Gestalt und das Ansehn desselben, auf eine merkwürdige und außerordentliche, jedem Freunde der Kunst gewiß höchst überraschende Art, umgewandelt und bestimmt; und wenn wir ihn, wie uns die Würde und der Glanz seiner äußern Lage hoffen läßt, länger und unausgesetzt, in unserer Mitte behalten, so steht zu erwarten, daß er dem Theater, (was ihm, zu besitzen, das erste Bedürfniß ist,) vielleicht auf eine unwandelbare und nicht wieder zu verwischende Art, einprägen werde: nämlich, einen Charakter.Zwar sind nicht alle Kunstfreunde, und besonders nicht die, die aus der neuesten Schule hervorgegangen sind, mit den Grundsätzen, nach denen er verfährt, einverstanden; aber diejenigen, die er sich aufgestellt hat, verfolgt er mit Energie, Sicherheit unerschütterlicher Consequenz: Eigenschaften, die selbst fehlerhafte Maasregeln, heilsamer und ersprieß licher machen können, als gute, wenn dieselben ihnen fehlen.

Die Hauptursache, wodurch wir dies erreicht, liegt in dem glücklichen Verhältniß, in welchem wir seit mehreren Jahren schon, mit der Kritik stehen; mit der Kritik, dieser unschätzbaren und unzertrennlich schwesterlichen Begleiterinn jedes Theaters dem es darum zu thun ist, der Vollendung, auf dem kürzesten und raschesten Wege, entgegenzuschreiten. Männer, von eben soviel Einsicht als Unpartheilichkeit, haben in den öffentlichen, vom Staat anerkannten Blättern, das Geschäft permanenter Theaterkritiken übernommen; und nur die schändlichste Verläumdung hat Gefälligkeiten, die die Direction, vielleicht aus persönlicher Freundschaft für sie hat, die Wendung geben können, als ob sie dadurch bestochen wären. Gleichheit, Uebereinstimmung und innerliche Congruenz der Ansichten, im Fache der Kunst, bestimmen dieselben, mit ganz uneigennützigem Eifer, durch Belehrung und Würdigung dessen, was sich auf der Bühne zeigt, in die Zwecke der Direction einzugreifen; und wenn ein pecuniaires Interesse (was zu läugnen gar keine Ursache ist) bei dem Geschäft, dem sie sich unterzogen haben, zum Grunde liegt, so ist es kein anderes, als das, was jedem Schriftsteller, der Manuscripte an seinen Buchhändler abliefert, statuirt ist. Demnach haben wir, seit mehreren Jahren schon, die glückliche, allerdings den Neid der Uebelgesinnten reizende, Erscheinung, daß dasjenige Organ, welches das größeste Publikum hat, auf Seiten des Theaters ist; dergestalt daß eine Stimme, die ihre Recensionen durchkreuzte und das Publikum irre zu führen bestimmt wäre, sich nur in untergeordnete und obscure Blätter verlieren und aus diesen in die fremden, ausländischen aufgenommen werden kann; und auch für die Unschädlichkeit solcher Intriguen ist, auf mancherlei Weise, bei uns gesorgt.

Und in der That, wenn eine Direktion das Feld der Kritik so erschöpft hat, als man es von derjenigen deren wir uns jetzt erfreun, voraussetzen kann: wozu kann man fragen, das Raisonniren und Rezensiren, das doch niemals aus dem Standpunkt geschieht, der einmal, auf unabänderliche Weise, nach einer bestimmten Wahl des Besseren, angenommen ist, wozu, fragen wir, dergleichen, als nur die Eintracht, die zwischen Publikum und Direktion herrschen soll, zu stören, das Publikum gegen das Verfahren, das dieselbe beobachtet, argwöhnisch und mißtrauisch zu machen, und demnach den ganzen Kunstgenuß, die Totalität der Wirkungen, ästhetischer sowohl als moralischer und philantropischer, die die Direktion beabsichtigt, auf die unzweckmäßigste und widerwärtigste Weise, zu nichte zu machen?

Excentrische Köpfe, Kraftgenies und poetische Revolutionairs aller Art machen sich, wir wissen es gar wohl, in witzigen und unwitzigen Aeußerungen, über diese sogenannte „Theaterheiligkeit“ und den neuesten „Theaterpabst“ sehr lustig; sie führen an, selbst die Kirche habe dulden müssen, daß man die Fackel der Untersuchung in ihr Allerheiligstes hineintrage; doch weit entfernt, uns durch Persiflagen dieser Art, deren unreine Quelle nur zu sehr am Tage liegt, irre machen zu lassen, so soll dies nur ein Grund mehr sein, die Thür unseres kleinen freundlichen Tempels (soviel es sein kann) vor ihrer unberufenen, zudringlichen und leichtfertigen Fackel zu verschließen. Zu einer Zeit, dünkt uns, da alles wankt, ist es um so nöthiger, daß irgend etwas fest stehe: und wenn es der Kirche, nach der sublimen Divination dieser Herren, (welches Gott verhüten wolle!) bestimmt wäre, im Strom der Zeiten unterzugehen, so wüßten wir nicht, was geschickter wäre, an ihre Stelle gesetzt zu werden, als ein Nationaltheater, ein Institut, dem das Geschäft der Nationalbildung und Entwickelung und Entfaltung aller ihrer höhern und niedern Anlagen, Eigenthümlichkeiten und Tugenden, vorzugsweise vor allen andern Anstalten, übertragen ist.

Berlin, d. 20. Nov. 1810. μη.

N. S. Gestern sahen wir hier Pachter Feldkümmel; in Kurzem werden wir wieder Vetter Kukkuk und vielleicht auch Rochus Pumpernikkel sehn."
10_46_3,An den Großherrn,1810-11-22,Heinrich von Kleist,[[ba_10_46.md]],"An den Großherrn.

(Als er den Mufti absetzte.)

Recht hast du, Herr! Ein kleines Licht Paßt auf den Kirchenleuchter nicht."
10_06_5,(Anzeige Hitzig v. 6.10.1810),1810-10-06,J. E. Hitzig,[[ba_10_06.md]],"Interessante Schriften, welche in der Buchhandlung von J. E. Hitzig zu haben sind.

J. C. F. Meister, Ueber den Eid nach reinen Vernunftbegriffen. Eine von den hohen Curatoren des Stolpeschen Legats auf der weltberühmten Universität Leyden gekrönte Preisschrift, nach dem lateinischen Originale in freyer deutscher Bearbeitung für das liebe Deutsche Vaterland. 13 gr."
10_68_5,(Anzeige Hitzig 18.12.1810),1810-12-18,J.E. Hitzig,[[ba_10_68.md]],"Die wichtigen Mémoires sur le premier Partage de la Pologne etc. von denen in öffentlichen Blättern so mannigfaltig die Rede ist, sind bei J. E. Hitzig hinter der katholischen Kirche Nr. 3. für 1 thl. zu haben."
10_73_4,Anfrage,1810-12-24,Heinrich von Kleist,[[ba_10_73.md]],"Anfrage.

Es ist unverkennbar, daß die französische Gemeinde hiesiger Residenz ein Geist der Frömmigkeit und der Gottesdienstlichkeit auszeichnet, den wir den deutschen Gemeinden wohl wünschen möchten. — Daher zeigt sich auch in den wohlthätigen Anstalten der französischen Colonie, und überhaupt in allen Gemeindeangelegenheiten, ein musterhafter Wetteifer der Größten und Geringsten für alles Fördernde und Gute. — Und so hat es nicht fehlen können, daß einerseits das Bedürfniß dieser Gemeinde nach ausgezeichneten Kanzelrednern immer befriedigt worden, und daß andrerseits viele und distinguirte Glieder der deutschen Gemeinden sich in Rücksicht auf den Sonntäglichen Gottesdienst an die französische angeschlossen haben.

Bei dieser Gelegenheit möchten wir fragen, warum in den sonntäglichen Kirchenlisten im Berliner Intelligenzblatte, die in den französischen Kirchen predigenden nicht mehr wie vormals angezeigt werden, da doch in den Verzeichnissen der Aufgebotenen desselben Blattes die französischen Gemeinden nicht übergangen werden. Mehrere freiwillige Glieder dieser Gemeinde, die den Nachfolger des Herrn Staatsrath Ancillon, dieses vortrefflichen Kanzelredners, zu hören wünschten, haben nur mit Mühe erfahren können, daß er am ersten Weihnachtsfeiertage Vormittags in der Werderschen Kirche predigen wird."
10_72_2,Ankündigung,1810-12-22,Heinrich von Kleist,[[ba_10_72.md]],"Ankündigung.

Durch höhere Unterstützungen werden die zur Erhebung und Belebung des Antheils an den vaterländischen Angelegenheiten unternommenen und mit dem Beifall des Publikums auf unerwartete Weise beehrten Berliner Abendblätter in zwei Punkten, vom 1sten Januar 1811 an, folgende wesentliche Ausdehnung erhalten; nämlich:

1) Werden dieselben in wöchentlichen Darstellungen, specielle Mittheilungen über alle, das Gemeinwohl und die öffentliche Sicherheit betreffende interessante Ereignisse, in dem ganzen Umfange der Monarchie, enthalten.

2) Wird das Bülletin der öffentlichen Blätter ausführlicher, als es bisher geschehen ist, einen Auszug der wichtigsten, neu angekommenen, officiellen Nachrichten des Auslandes communicieren, und in so fern, da das Blatt täglich erscheint und der Abgang der Posten zu seiner täglichen Versendung benutzt werden kann, eine Art von Vorläufer der Zeitungen werden.

Alles Uebrige bleibt, wie es ist. Die Veränderungen der vaterländischen Gesetzgebung, zuvörderst der nächste und würdigste Gegenstand der allgemeinen Theilnahme, werden, nach wie vor, mit unbefangenem patriotischen Geiste gewürdigt, die bedeutendsten Erscheinungen der Literatur angezeigt und das Theater, in einem periodisch wiederkehrenden Artikel, einer kurzen und gründlichen Kritik unterzogen werden. Das Ganze wird, wie bisher, zunächst von der Liebe für Vaterland und König, und, in weiterer Beziehung, vom Eifer für alles Gute in allen Ständen und Wirkungskreisen, durchdrungen sein. —

Redaktion der Berliner Abendblätter"
10_20_2,Zuschrift eines Predigers an den Hrsg,1810-10-20,Heinrich von Kleist,[[ba_10_20.md]],"Zuschrift eines Predigers an den Herausgeber der Berliner Abendblätter.

Mein Herr, Der Erfinder der neuesten Quinen-Lotterie hat die aufgeklärte Absicht gehabt, die aberwitzige Traumdeuterei, zu welcher, in der Zahlen-Lotterie, die Freiheit, die Nummern nach eigner Willkühr zu wählen, Veranlassung gab, durch bestimmte und feststehende Loose, die die Direction ausschreibt, niederzuschlagen.

Mit Bedauern aber machen wir die Erfahrung, daß diese Absicht nur auf sehr unvollkommene Weise erreicht wird, indem der Aberglauben, auf einem Gebiet, auf dem man ihn gar nicht erwartet hatte, wieder zum Vorschein kommt.

Es ist wahr, die Leute träumen jetzt keine Nummern mehr; aber sie träumen die Namen der Collecteurs, bei denen man setzen kann. Die gleichgültigsten Veranlassungen nehmen sie, in einer Verkettung von Gedanken, zu welchen kein Mensch die Mittelglieder errathen würde, für geheimnißvolle Winke der Vorsehung an. Verwichenen Sonntag nannte ich den David, auf der Kanzel, einen gottgefälligen Mann; nicht den Collecteur dieses Orts, wie Dieselben leicht denken können, sondern den israëlitischen König, den bekannten Sänger der frommen Psalmen. Tags darauf ließ mir der Collecteur, durch einen Freund, für meine Predigt, scherzhafter Weise danken, indem alle Quinenloose, wie er mir versicherte, bei ihm vergriffen worden waren.

Ich bitte Sie, mein Herr, diesen Vorfall zur Kenntniß des Publicums zu bringen, und durch Ihr Blatt, wenn es möglich ist, den Entwurf einer anderweitigen Lotterie zu veranlassen, die den Aberglauben auf eine bestimmtere und so unbedingte Weise, als es der Wunsch aller Freunde der Menschheit ist, ausschließe.

F... d. 15. Okt. 1810.

F..."
10_47_3,Der Kreis,1810-11-23,Friedrich Gottlob Wetzel,[[ba_10_47.md]],"Der Kreis.

Wo der Anfang sei? Geh doch, und frag’ nach dem Ende! Hast du das Ende, dann ist dir auch der Anfang gewiß. W."
10_12_6,Polizeiliche Tages-Mittheilungen. (13.10.1810),1810-10-13,Heinrich von Kleist,[[ba_10_12.md]],"Polizeiliche Tages-Mittheilungen.

Auf dem Markte ist einem fremden Müller eine abgenutzte Metze zerschlagen und eine ungestempelte nach Erlegung von 2 Rthlr. Strafe konfiszirt.

Einem hiesigen Einwohner, ist ein silberner Vorlegelöffel und Eßlöffel gestohlen."
